{
  "$schema": "https://json-schema.org/draft/2020-12/schema",
  "$id": "https://hachure.org/schemas/trust-bundle.schema.json",
  "title": "Hachure TrustBundle",
  "type": "object",
  "additionalProperties": false,
  "required": ["schemaVersion", "source", "claims", "evidence", "policies", "events"],
  "allOf": [
    {
      "$comment": "schemaVersion 8: a claim's conclusionConfidence.value must name the calibration table that produced it (ai-evaluation.md). Earlier versions carry this as a SHOULD.",
      "if": { "properties": { "schemaVersion": { "minimum": 8 } } },
      "then": {
        "properties": {
          "claims": {
            "items": {
              "properties": {
                "conclusionConfidence": { "dependentRequired": { "value": ["calibration"] } }
              }
            }
          }
        }
      }
    }
  ],
  "properties": {
    "schemaVersion": { "enum": [5, 6, 7, 8] },
    "source": { "type": "string" },
    "producerId": {
      "type": "string",
      "minLength": 1,
      "description": "Optional stable identifier for the producing system, distinct from source (which is free-text and may vary per run). When present, MUST be a non-empty string (minLength: 1) -- see merge.md section 2. Omitted (never synthesized) on a merged bundle."
    },
    "claims": {
      "type": "array",
      "items": { "$ref": "claim.schema.json" }
    },
    "evidence": {
      "type": "array",
      "items": { "$ref": "evidence.schema.json" }
    },
    "policies": {
      "type": "array",
      "items": { "$ref": "verification-policy.schema.json" }
    },
    "events": {
      "type": "array",
      "items": { "$ref": "verification-event.schema.json" }
    },
    "identityLinks": {
      "type": "array",
      "items": { "$ref": "#/$defs/identityLink" }
    },
    "claimGroups": {
      "type": "array",
      "items": { "$ref": "#/$defs/claimGroup" }
    },
    "authorityTrace": {
      "type": "array",
      "items": { "$ref": "#/$defs/authorityTrace" }
    },
    "proof": {
      "type": "object",
      "description": "Optional signing/anchoring block (added at schemaVersion 6). Carries integrity anchors produced under the Assurance profile (assurance.md) -- e.g. a transparency_log anchor holding a Rekor entry UUID (interop-in-toto.md section 'Upload to Rekor directly'), or a signature anchor. Absence means the bundle is L0 (unsigned, producer-asserted). Presence never changes status derivation; it is verified out-of-band per the consumer's assurance policy.",
      "additionalProperties": false,
      "properties": {
        "anchors": {
          "type": "array",
          "items": { "$ref": "#/$defs/integrityAnchor" }
        },
        "metadata": { "type": "object" }
      }
    }
  },
  "$defs": {
    "subjectRef": {
      "type": "object",
      "required": ["subjectType", "subjectId"],
      "properties": {
        "subjectType": { "type": "string" },
        "subjectId": { "type": "string" }
      },
      "additionalProperties": false
    },
    "identityLink": {
      "type": "object",
      "required": ["subjects"],
      "properties": {
        "id": { "type": "string" },
        "subjects": {
          "type": "array",
          "minItems": 2,
          "items": { "$ref": "#/$defs/subjectRef" }
        },
        "reason": { "type": "string" },
        "attestedBy": { "type": "string" },
        "relation": { "enum": ["equivalent", "subsumes", "converts"] },
        "conversion": {
          "type": "object",
          "properties": {
            "factor": { "type": "number" },
            "offset": { "type": "number" },
            "note": { "type": "string" }
          },
          "additionalProperties": false
        },
        "mappingClaimId": { "type": "string" }
      },
      "additionalProperties": false
    },
    "authorityTrace": {
      "type": "object",
      "required": ["id", "subject", "actorRef", "authorityType", "authorityRef", "sourceRef", "observedAt"],
      "properties": {
        "id": { "type": "string" },
        "subject": { "$ref": "#/$defs/subjectRef" },
        "actorRef": { "type": "string" },
        "authorityType": { "enum": ["role", "permission", "credential", "system", "organization", "policy", "other"] },
        "authorityRef": { "type": "string" },
        "sourceRef": { "type": "string" },
        "observedAt": { "type": "string", "format": "date-time" },
        "evidenceIds": { "type": "array", "items": { "type": "string" } },
        "claimIds": { "type": "array", "items": { "type": "string" } },
        "validFrom": { "type": "string", "format": "date-time" },
        "validUntil": { "type": "string", "format": "date-time" },
        "revokedAt": { "type": "string", "format": "date-time" },
        "integrityRef": { "type": "string" },
        "integrityAnchor": { "$ref": "#/$defs/integrityAnchor" },
        "metadata": { "type": "object" }
      },
      "additionalProperties": false
    },
    "integrityAnchor": {
      "type": "object",
      "required": ["id", "kind", "algorithm", "value", "sourceRef"],
      "properties": {
        "id": { "type": "string" },
        "kind": { "enum": ["hash", "signature", "transparency_log", "timestamp", "external_ref", "other"] },
        "algorithm": { "type": "string" },
        "value": { "type": "string" },
        "sourceRef": { "type": "string" },
        "observedAt": { "type": "string", "format": "date-time" },
        "verificationStatus": { "enum": ["unverified", "verified", "failed", "not_applicable"] },
        "verifiedAt": { "type": "string", "format": "date-time" },
        "verifiedBy": { "type": "string" },
        "metadata": { "type": "object" }
      },
      "additionalProperties": false
    },
    "claimGroup": {
      "type": "object",
      "required": ["id", "title", "kind"],
      "properties": {
        "id": { "type": "string" },
        "title": { "type": "string" },
        "kind": { "enum": ["claimGroup", "framework", "requirement-set"] },
        "description": { "type": "string" },
        "claimIds": { "type": "array", "items": { "type": "string" } },
        "requirements": {
          "type": "array",
          "items": { "$ref": "#/$defs/claimRequirement" }
        },
        "rollupPolicy": {
          "type": "object",
          "required": ["mode"],
          "properties": {
            "mode": { "enum": ["all-required", "any-required"] },
            "requiredRequirementIds": { "type": "array", "items": { "type": "string" } },
            "optionalRequirementIds": { "type": "array", "items": { "type": "string" } }
          },
          "additionalProperties": false
        },
        "metadata": { "type": "object" }
      },
      "additionalProperties": false
    },
    "claimRequirement": {
      "type": "object",
      "required": ["id", "title", "claimIds"],
      "properties": {
        "id": { "type": "string" },
        "title": { "type": "string" },
        "claimIds": { "type": "array", "items": { "type": "string" } },
        "required": { "type": "boolean" },
        "severity": { "enum": ["low", "medium", "high", "critical"] },
        "validationStrategy": { "$ref": "#/$defs/validationStrategy" },
        "metadata": { "type": "object" }
      },
      "additionalProperties": false
    },
    "validationStrategy": {
      "type": "object",
      "properties": {
        "requiredEvidence": {
          "type": "array",
          "items": { "enum": ["source_excerpt", "test_output", "runtime_observation", "human_attestation", "attestation", "calculation_trace", "document_citation", "crawl_observation", "policy_rule"] }
        },
        "requiredMethods": {
          "type": "array",
          "items": { "enum": ["observation", "extraction", "validation", "corroboration", "attestation", "auditability", "anchoring", "monitoring"] }
        },
        "requiresCorroboration": { "type": "boolean" },
        "acceptanceCriteria": { "type": "array", "items": { "type": "string" } },
        "reviewAuthority": { "type": "string" },
        "notes": { "type": "string" },
        "metadata": { "type": "object" }
      },
      "additionalProperties": false
    }
  },
  "not": {
    "anyOf": [
      { "required": ["id"] },
      { "required": ["generatedAt"] },
      { "required": ["summary"] },
      { "required": ["transparencyGaps"] },
      { "required": ["evidenceRequirementsByClaimId"] }
    ]
  }
}
