{
  "schemaVersion": 7,
  "source": "deployment-verifier:oauth-service:2026-06-30",
  "producerId": "deployment-verifier",
  "claims": [
    {
      "id": "claim.contract.compose-env-to-app-oauth",
      "subjectType": "deployment",
      "subjectId": "oauth-service:production",
      "claimType": "contract",
      "fieldOrBehavior": "env-passthrough",
      "value": true,
      "createdAt": "2026-06-30T18:00:00.000Z",
      "updatedAt": "2026-06-30T18:05:00.000Z",
      "impactLevel": "critical",
      "verificationPolicyId": "policy.contract.live-exercise",
      "qualifiers": {
        "provider": "compose.env",
        "consumer": "app.oauth",
        "contract": "GOOGLE_CLIENT_ID reaches process env"
      }
    }
  ],
  "evidence": [
    {
      "id": "evidence.contract.oauth.unit-test",
      "claimId": "claim.contract.compose-env-to-app-oauth",
      "evidenceType": "test_output",
      "method": "validation",
      "sourceRef": "ci://oauth-service/runs/1842/env-mapping-test",
      "excerptOrSummary": "The compose-to-process environment mapping passed in the isolated test environment.",
      "observedAt": "2026-06-30T18:00:00.000Z",
      "collectedBy": "ci",
      "supportStrength": "entails",
      "passing": true,
      "blocking": true,
      "execution": {
        "runner": "bash",
        "label": "isolated OAuth environment mapping test",
        "exitCode": 0,
        "durationMs": 812,
        "environment": "test"
      }
    },
    {
      "id": "evidence.contract.oauth.production-receipt",
      "claimId": "claim.contract.compose-env-to-app-oauth",
      "evidenceType": "runtime_observation",
      "method": "observation",
      "sourceRef": "deploy://oauth-service/production/runs/1842/post-deploy-contract-check",
      "excerptOrSummary": "Post-deploy probe traversed compose.env into the app.oauth process and confirmed GOOGLE_CLIENT_ID is present and non-empty; the value was not recorded.",
      "observedAt": "2026-06-30T18:05:00.000Z",
      "collectedBy": "deployment-verifier",
      "supportStrength": "entails",
      "passing": true,
      "blocking": true,
      "execution": {
        "runner": "bash",
        "label": "production OAuth environment passthrough probe",
        "exitCode": 0,
        "durationMs": 1460,
        "environment": "production",
        "metadata": {
          "provider": "compose.env",
          "consumer": "app.oauth",
          "secretValueRecorded": false
        }
      }
    }
  ],
  "policies": [
    {
      "id": "policy.contract.live-exercise",
      "claimType": "contract",
      "requiredEvidence": ["runtime_observation"],
      "requiredMethods": ["observation"],
      "requiresCorroboration": false,
      "acceptanceCriteria": [
        "the provider-to-consumer path is exercised in a running target environment",
        "the observed result directly entails the stated contract"
      ],
      "reviewAuthority": "deployment-verifier",
      "validityRule": {
        "kind": "duration",
        "durationDays": 7
      },
      "stalenessTriggers": [
        "provider configuration changes",
        "consumer version changes",
        "target environment is redeployed"
      ],
      "conflictRules": [
        "a blocking failed live exercise disputes the claim"
      ],
      "impactLevel": "critical"
    }
  ],
  "events": [
    {
      "id": "event.contract.oauth.verified",
      "claimId": "claim.contract.compose-env-to-app-oauth",
      "status": "verified",
      "type": "verification",
      "actor": "deployment-verifier",
      "method": "automated-contract-check",
      "evidenceIds": [
        "evidence.contract.oauth.unit-test",
        "evidence.contract.oauth.production-receipt"
      ],
      "createdAt": "2026-06-30T18:05:01.000Z",
      "verifiedAt": "2026-06-30T18:05:01.000Z"
    }
  ]
}
